{
  "$schema": "http://json-schema.org/draft-07/schema#",
  "$id": "https://raw.githubusercontent.com/brandflowr/SKELETON-Brandflowr/v2.10.0/spec/studio.schema.json",
  "$comment": "Versioned, immutable release URL (git tag v2.10.0); 'main' carries the latest. See GOVERNANCE.md. Asset definitions are $ref'd from skel.schema.json so embedded snapshots and registry records can never drift apart. Validators must load both schemas.",
  "title": "SKEL Studio Registry",
  "description": "The studio registry (studio.json) — the story bible. Canonical, cross-project home of characters, environments, locations, props, voices, skins, palettes, and series. SKEL documents reference these assets by ID; on export, hosts copy referenced records into the document as embedded snapshots. See studio-spec.md for precedence and snapshot rules.",
  "type": "object",
  "required": ["studio_version", "studio_id", "name"],
  "additionalProperties": false,
  "properties": {
    "$schema": { "type": "string" },
    "studio_version": {
      "type": "string",
      "pattern": "^\\d+\\.\\d+(\\.\\d+)?$",
      "description": "Version of the studio registry format. Follows the SKEL spec version; current: 1.0."
    },
    "studio_id": { "type": "string", "description": "Stable unique identifier for this studio/workspace." },
    "name": { "type": "string", "description": "Human-readable studio or workspace name." },
    "description": { "type": "string" },
    "created_at": { "type": "string", "format": "date-time" },
    "modified_at": {
      "type": "string",
      "format": "date-time",
      "description": "Registry-level modification timestamp. Snapshot/registry conflicts resolve by the newer modified_at (see studio-spec.md §4)."
    },
    "characters": {
      "type": "array",
      "description": "Canonical character records. Same definition as embedded snapshots in .skel documents.",
      "items": { "$ref": "skel.schema.json#/definitions/Character" }
    },
    "environments": {
      "type": "array",
      "description": "Canonical environment records (dressed/lit variants of locations).",
      "items": { "$ref": "skel.schema.json#/definitions/Environment" }
    },
    "locations": {
      "type": "array",
      "description": "Canonical location records (physical places).",
      "items": { "$ref": "skel.schema.json#/definitions/Location" }
    },
    "props": {
      "type": "array",
      "description": "Canonical prop records (continuity objects).",
      "items": { "$ref": "skel.schema.json#/definitions/Prop" }
    },
    "audio_assets": {
      "type": "array",
      "description": "Canonical audio asset records referenced by sound_effects, music_cues, and environments' soundscape_refs.",
      "items": { "$ref": "skel.schema.json#/definitions/AudioAsset" }
    },
    "voices": {
      "type": "array",
      "description": "Casting/TTS voice registry. Character.voice.voice_settings may reference a registry voice by voice_ref instead of repeating provider settings.",
      "items": { "$ref": "#/definitions/Voice" }
    },
    "skins": {
      "type": "array",
      "description": "Visual style presets. metadata.skin_key in a .skel document resolves to a skin id here.",
      "items": { "$ref": "#/definitions/Skin" }
    },
    "palettes": {
      "type": "array",
      "description": "Named color palettes referenced by skins and style tooling.",
      "items": { "$ref": "#/definitions/Palette" }
    },
    "series": {
      "type": "array",
      "description": "Series documents: seasons, episode index, arcs, and shared cast. metadata.series.series_id in an episode .skel resolves here.",
      "items": { "$ref": "#/definitions/Series" }
    },
    "notes": { "type": "string" },
    "extensions": {
      "type": "object",
      "description": "Vendor-namespaced extension data. Keys MUST start with 'x-'.",
      "propertyNames": { "pattern": "^x-" }
    }
  },
  "definitions": {
    "Voice": {
      "type": "object",
      "required": ["id"],
      "additionalProperties": false,
      "properties": {
        "id": { "type": "string" },
        "label": { "type": "string" },
        "description": { "type": "string" },
        "accent": { "type": "string" },
        "provider": { "type": "string", "description": "TTS provider namespace, e.g. elevenlabs." },
        "voice_id": { "type": "string", "description": "Provider-side voice identifier." },
        "settings": {
          "type": "object",
          "additionalProperties": true,
          "description": "Provider settings (stability, similarity, style, ...)."
        },
        "tags": { "type": "array", "items": { "type": "string" } }
      }
    },
    "Skin": {
      "type": "object",
      "required": ["id"],
      "additionalProperties": false,
      "description": "A reusable visual style preset. The resolution target of metadata.skin_key.",
      "properties": {
        "id": { "type": "string", "description": "The skin key referenced by metadata.skin_key (e.g. noir_v1)." },
        "label": { "type": "string" },
        "description": { "type": "string" },
        "style_text": {
          "type": "string",
          "description": "Canonical style prompt text injected by style-aware BONEs. The style analogue of identity_lock/style_lock."
        },
        "palette_ref": { "type": "string", "description": "Palette id from the palettes collection." },
        "v_setup_defaults": {
          "type": "object",
          "additionalProperties": true,
          "description": "Default v_setup token values this skin implies (e.g. light: noir, color: desaturated, texture: film_35mm)."
        },
        "reference_images": { "type": "array", "items": { "type": "string" } },
        "extensions": {
          "type": "object",
          "propertyNames": { "pattern": "^x-" }
        }
      }
    },
    "Palette": {
      "type": "object",
      "required": ["id"],
      "additionalProperties": false,
      "properties": {
        "id": { "type": "string" },
        "label": { "type": "string" },
        "colors": {
          "type": "array",
          "items": { "type": "string", "pattern": "^#([0-9a-fA-F]{3}|[0-9a-fA-F]{6}|[0-9a-fA-F]{8})$" },
          "description": "Hex color values."
        },
        "notes": { "type": "string" }
      }
    },
    "Series": {
      "type": "object",
      "required": ["series_id", "title"],
      "additionalProperties": false,
      "description": "A show: its seasons, episode index, arcs, and shared cast. Episode .skel files point back here via metadata.series.",
      "properties": {
        "series_id": { "type": "string" },
        "title": { "type": "string" },
        "format": {
          "type": "string",
          "enum": ["limited", "ongoing", "anthology"],
          "description": "limited = fixed episode count; ongoing = open-ended; anthology = standalone episodes sharing a frame."
        },
        "logline": { "type": "string" },
        "seasons": {
          "type": "array",
          "items": { "$ref": "#/definitions/Season" }
        },
        "arcs": {
          "type": "array",
          "description": "Story arcs spanning episodes. Episodes advance arcs via metadata.series.arc_refs.",
          "items": { "$ref": "#/definitions/Arc" }
        },
        "cast_refs": {
          "type": "array",
          "items": { "type": "string" },
          "description": "Character IDs from this registry's characters collection shared across the series. The cross-episode identity-lock guarantee: one cast, many stories."
        },
        "notes": { "type": "string" },
        "extensions": {
          "type": "object",
          "propertyNames": { "pattern": "^x-" }
        }
      }
    },
    "Season": {
      "type": "object",
      "required": ["season"],
      "additionalProperties": false,
      "properties": {
        "season": { "type": "integer", "minimum": 0 },
        "title": { "type": "string" },
        "episodes": {
          "type": "array",
          "items": { "$ref": "#/definitions/Episode" }
        }
      }
    },
    "Episode": {
      "type": "object",
      "required": ["episode_code"],
      "additionalProperties": false,
      "properties": {
        "episode_code": { "type": "string", "description": "Display code such as S01E03. MUST match the episode document's metadata.series.episode_code." },
        "story_id": { "type": "string", "description": "The episode document's metadata.story_id." },
        "project_slug": { "type": "string", "description": "Host project slug where the episode's .skel lives." },
        "title": { "type": "string" },
        "logline": { "type": "string" },
        "status": { "type": "string", "description": "Free-form episode status label (e.g. outlined, boarded, rendering, delivered)." }
      }
    },
    "Arc": {
      "type": "object",
      "required": ["id"],
      "additionalProperties": false,
      "properties": {
        "id": { "type": "string" },
        "title": { "type": "string" },
        "description": { "type": "string" },
        "spans": {
          "type": "array",
          "items": { "type": "string" },
          "description": "episode_codes this arc covers, in order."
        }
      }
    }
  }
}
